artist,title,lyrics,genre
Lukas Graham,7 Years,"7 Years Lyrics
Once, I was seven years old, my mama told me
""Go make yourself some friends, or you'll be lonely""
Once, I was seven years old

It was a big, big world, but we thought we were bigger
Pushing each other to the limits, we were learning quicker
By eleven, smoking herb and drinking burning liquor
Never rich, so we were out to make that steady figure

Once, I was eleven years old, my daddy told me
""Go get yourself a wife, or you'll be lonely""
Once, I was eleven years old

I always had that dream like my daddy before me
So I started writing songs, I started writing stories
Something about that glory just always seemed to bore me
'Cause only those I really love will ever really know me

Once, I was twenty years old, my story got told
Before the morning sun, when life was lonely
Once, I was twenty years old (Lukas Graham!)
I only see my goals, I don't believe in failure
'Cause I know the smallest voices, they can make it major
I got my boys with me, at least those in favor
And if we don't meet before I leave, I hope I'll see you later
Once, I was twenty years old, my story got told
I was writing 'bout everything I saw before me
Once, I was twenty years old

Soon, we'll be thirty years old, our songs have been sold
We've traveled around the world and we're still roaming
Soon, we'll be thirty years old

I'm still learning about life, my woman brought children for me
So I can sing them all my songs, and I can tell them stories
Most of my boys are with me, some are still out seeking glory
And some I had to leave behind, my brother, I'm still sorry

Soon, I'll be sixty years old, my daddy got sixty-one
Remember life and then your life becomes a better one
I made a man so happy when I wrote a letter once
I hope my children come and visit once or twice a month
Soon, I'll be sixty years old, will I think the world is cold?
Or will I have a lot of children who can warm me?
Soon, I'll be sixty years old
Soon, I'll be sixty years old, will I think the world is cold?
Or will I have a lot of children who can hold me?
Soon, I'll be sixty years old

Once, I was seven years old, my mama told me
""Go make yourself some friends, or you'll be lonely""
Once I was seven years old
Once I was seven years old187Embed",pop
BTS,Dynamite,"Dynamite Lyrics
'Cause I, I, I'm in the stars tonight
So watch me bring the fire and set the night alight

Shoes on, get up in the morn'
Cup of milk, let's rock and roll
King Kong, kick the drum
Rolling on like a Rolling Stone
Sing song when I'm walkin' home
Jump up to the top, LeBron
Ding-dong, call me on my phone
Ice tea and a game of ping pong

This is gettin' heavy, can you hear the bass boom? I'm ready (Woo-hoo)
Life is sweet as honey, yeah, this beat cha-ching like money, huh
Disco overload, I'm into that, I'm good to go
I'm diamond, you know I glow up
Hey, so let's go

'Cause I, I, I'm in the stars tonight
So watch me bring the fire and set the night alight (Hey)
Shinin' through the city with a little funk and soul
So I'ma light it up like dynamite, woah-oh-oh
Bring a friend, join the crowd, whoever wanna come along
Word up, talk the talk, just move like we off the wall
Day or night, the sky's alight, so we dance to the break of dawn (Hey)
Ladies and gentlemen, I got the medicine so you should keep ya eyes on the ball

Huh, this is gettin' heavy, can you hear the bass boom? I'm ready (Woo-hoo)
Life is sweet as honey, yeah, this beat cha-ching like money, huh
Disco overload, I'm into that, I'm good to go
I'm diamond, you know I glow up
Let's go

'Cause I, I, I'm in the stars tonight
So watch me bring the fire and set the night alight (Hey)
Shinin' through the city with a little funk and soul
So I'ma light it up like dynamite, woah-oh-oh

Dyn-na-na-na, na-na-na-na-na, na-na-na, life is dynamite
Dyn-na-na-na, na-na-na-na-na, na-na-na, life is dynamite
Shinin' through the city with a little funk and soul
So I'ma light it up like dynamite, woah-oh-oh

Dyn-na-na-na, na-na, na-na, ayy
Dyn-na-na-na, na-na, na-na, ayy
Dyn-na-na-na, na-na, na-na, ayy
Light it up like dynamite
Dyn-na-na-na, na-na, na-na, ayy
Dyn-na-na-na, na-na, na-na, ayy
Dyn-na-na-na, na-na, na-na, ayy
Light it up like dynamite
'Cause I, I, I'm in the stars tonight
So watch me bring the fire and set the night alight
Shinin' through the city with a little funk and soul
So I'ma light it up like dynamite
(This is ah) 'Cause I, I, I'm in the stars tonight
So watch me bring the fire and set the night alight (Alight, oh)
Shinin' through the city with a little funk and soul
So I'ma light (Light) it (It) up (Up) like (Like) dynamite (Dynamite), woah-oh-oh

Dyn-na-na-na, na-na-na-na-na, na-na-na, life is dynamite (Life is dynamite)
Dyn-na-na-na, na-na-na-na-na, na-na-na, life is dynamite (Oh)
Shinin' through the city with a little funk and soul
So I'ma light it up like dynamite, woah-oh-oh287Embed",pop
